<?xml version="1.0" encoding="UTF-8"?>
<xsd:schema xmlns:app="http://namespace.profile.com/ns/profile"
	targetNamespace="http://namespace.profile.com/ns/profile"
        xmlns:xsd="http://www.w3.org/2001/XMLSchema"	
        xmlns:e="http://namespace.profile.com/ns/empRecord"
	xmlns:cv="http://namespace.profile.com/ns/cv"
	xmlns:com="http://namespace.profile.com/ns/companyInfo"
	xmlns:t="http://namespace.profile.com/ns/transcript"
	elementFormDefault="qualified">
<!--
<xsd:import schemaLocation="empRecord.xsd"
namespace="http://namespace.profile.com/empRecord/e" />
<xsd:import schemaLocation="cv.xsd"
namespace="http://namespace.profile.com/cv" />
<xsd:import schemaLocation="companyInfo.xsd"
namespace="http://namespace.profile.com/companyInfo/com" />
<xsd:import schemaLocation="transcript.xsd"
namespace="http://namespace.profile.com/transcript/t" />
-->
    <xsd:element name="profile">
        <xsd:complexType>
            <xsd:sequence>
                <xsd:element name="cv_info">
                        <xsd:complexType>
                            <xsd:sequence>
                                <xsd:element name="name" type="xsd:string"/>
                                <xsd:element name="address" type="xsd:string"/>
                                <xsd:element name="telephone" type="xsd:string"/>
                                <xsd:element name="email" type="xsd:string" />
                                <xsd:element name="education" type="xsd:string"/>
                                <xsd:element name="language" type="xsd:string" minOccurs="0" maxOccurs="unbounded"/>                
                                <xsd:element name="qualifications" type="xsd:string"/>
                                <xsd:element name="jobType" type="xsd:string"/>
                                <xsd:element name="desiredPosition" type="xsd:string"/> 
                                <xsd:element name="references" type="xsd:string"/>
                                <xsd:element name="motivation" type="xsd:string"/>   
                            </xsd:sequence>
                        </xsd:complexType>  
                </xsd:element> 
                
                <xsd:element name="empRecord">
                        <xsd:complexType>
                            <xsd:sequence>
                            <xsd:element name="empName" type="xsd:string"/>
                            <xsd:element name="companyWorked" minOccurs="0" maxOccurs="unbounded">
                                <xsd:complexType>
                                    <xsd:sequence>
                                        <xsd:element name="workedAtComId" type="xsd:string"/>
                                        <xsd:element name="workedAt" type="xsd:string"/>
                                        <xsd:element name="duration" type="xsd:string"/>
                                        <xsd:element name="year" type="xsd:int"/>
                                        <xsd:element name="position" type="xsd:string"/>                       
                                    </xsd:sequence>
                                </xsd:complexType>    
                            </xsd:element>    
                            </xsd:sequence>
                        </xsd:complexType>
                </xsd:element>   
                               
                <xsd:element name="companyInfo">
                    <xsd:complexType>
                        <xsd:sequence>
                        <xsd:element name="companies">
                            <xsd:complexType>
                                <xsd:sequence>
                                        <xsd:element name="company" minOccurs="0" maxOccurs="unbounded">
                                            <xsd:complexType>
                                            <xsd:sequence>
                                                <xsd:element name="companyId" type="xsd:string"/>
                                                <xsd:element name="companyName" type="xsd:string"/>
                                                <xsd:element name="category" type="xsd:string"/>
                                                <xsd:element name="founders" type="xsd:string"/>
                                                <xsd:element name="ceo" type="xsd:string"/>
                                                <xsd:element name="location" type="xsd:string"/>
                                                <xsd:element name="contact" type="xsd:string"/>
                                            </xsd:sequence> 
                                          </xsd:complexType>
                                        </xsd:element>
                                </xsd:sequence>
                            </xsd:complexType>
                        </xsd:element>
                        </xsd:sequence>
                    </xsd:complexType>
                </xsd:element>	
                
                <xsd:element name="transcript">
                    <xsd:complexType>
                        <xsd:sequence>
                            <xsd:element name="studentName" type="xsd:string"/>
                            <xsd:element name="university" type="xsd:string"/>
                            <xsd:element name="program" type="xsd:string"/>
                            <xsd:element name="issueDate" type="xsd:date"/>
                            <xsd:element name="gpa" type="xsd:decimal" minOccurs="0"/>
                            <xsd:element name="courses">
                                <xsd:complexType>
                                    <xsd:sequence>
                                        <xsd:element name="course" minOccurs="1" maxOccurs="unbounded">
                                            <xsd:complexType>
                                                    <xsd:sequence>
                                                            <xsd:element name="code">
                                                                    <xsd:simpleType>
                                                                    <xsd:restriction base="xsd:string">
                                                                            <xsd:pattern value="[A-Z][A-Z][0-9][0-9][0-9][0-9]"/>
                                                                    </xsd:restriction>
                                                                    </xsd:simpleType>
                                                            </xsd:element>	
                                                            <xsd:element name="title" type="xsd:string" />
                                                            <xsd:element name="credits" type="xsd:decimal" />
                                                            <xsd:element name="grade" type="xsd:string" />
                                                    </xsd:sequence>
                                            </xsd:complexType>
                                        </xsd:element>
                                    </xsd:sequence>
                                </xsd:complexType>
                            </xsd:element>               
                        </xsd:sequence>
                    </xsd:complexType>
                </xsd:element>                                        
                                                	
            </xsd:sequence>
        </xsd:complexType>
    </xsd:element>  
</xsd:schema>
