<?xml version="1.0" encoding="UTF-8"?>
<!--
To change this template, choose Tools | Templates
and open the template in the editor.
-->


<app:profile
    xmlns:xsi='http://www.w3.org/2001/XMLSchema-instance'
    xmlns:app='http://namespace.profile.com/ns/profile'
    xsi:schemaLocation='http://namespace.profile.com/ns/profile profile.xsd'>
    <cv_info>
    <name>dhf</name>
    <address>hgs</address>
    <telephone>464364</telephone>
    <telephone>3464</telephone>
    <email>fsdh@sh.se</email>
    <email>fsdh@sh.se</email>
    <education>
        <university>ry</university>
        <program>sth</program>
        <gpa>3.6</gpa>
    </education>
    <language>tst</language>
    <language>sthss</language>
    <qualifications>styste</qualifications>
    <jobType>sth</jobType>
    <desiredPosition>sty</desiredPosition>
    <references>stdu</references>
    <motivation>stuw</motivation>
    </cv_info>
    <empRecord>
        <empName>twwww</empName>
        <workedAt>stwwhw</workedAt>
        <year>3245</year>
        <duration>stru</duration>
        <position>swtusw</position>
    </empRecord>
    <empRecord>
        <empName>stuwe</empName>
        <workedAt>srtuwu</workedAt>
        <year>2454</year>
        <duration>45 tht</duration>
        <position>5ywew</position>
    </empRecord>
    <companyInfo>
        <companyName>trhwrewh</companyName>
        <category>wthwh</category>
        <founders>wehyew</founders>
        <ceo>wethyeq</ceo>
        <location>weh5ye5qw</location>
        <contact>wehywe</contact>
    </companyInfo>

</app:profile>
