<?xml version="1.0" encoding="UTF-8"?>
<app:profile
    xmlns:xsi='http://www.w3.org/2001/XMLSchema-instance'
    xmlns:app='http://namespace.profile.com/profile'
    xsi:schemaLocation='http://namespace.profile.com/profile profile.xsd'>
    <app:cv_info>
        <app:name></app:name>
        <app:address></app:address>
        <app:telephone></app:telephone>
        <app:email></app:email>
        <app:education></app:education>
        <app:language></app:language>
        <app:qualifications></app:qualifications>
        <app:jobType></app:jobType>
        <app:desiredPosition></app:desiredPosition>
        <app:references></app:references>
        <app:motivation></app:motivation>
    </app:cv_info>
    <app:empRecord>
        <app:empName></app:empName>
        <app:companyWorked>
            <app:workedAtComId></app:workedAtComId>
            <app:workedAt></app:workedAt>
            <app:duration></app:duration>
            <app:year></app:year>
            <app:position></app:position>
        </app:companyWorked>
    </app:empRecord>
    <app:companyInfo>
        <app:companies>
            <app:company>
                <app:companyId></app:companyId>
                <app:companyName></app:companyName>
                <app:category></app:category>
                <app:founders></app:founders>
                <app:ceo></app:ceo>
                <app:location></app:location>
                <app:contact></app:contact>
            </app:company>
        </app:companies>
    </app:companyInfo>
    <app:transcript>
        <app:studentName></app:studentName>
        <app:university></app:university>
        <app:program></app:program>
        <app:issueDate></app:issueDate>
        <app:gpa></app:gpa>
        <app:courses>
            <app:course>
                <app:code></app:code>
                <app:title></app:title>
                <app:credits></app:credits>
                <app:grade></app:grade>
            </app:course>
            <app:course>
                <app:code></app:code>
                <app:title></app:title>
                <app:credits></app:credits>
                <app:grade></app:grade>
            </app:course>
            <app:course>
                <app:code></app:code>
                <app:title></app:title>
                <app:credits></app:credits>
                <app:grade></app:grade>
            </app:course>
            <app:course>
                <app:code></app:code>
                <app:title></app:title>
                <app:credits></app:credits>
                <app:grade></app:grade>
            </app:course>
        </app:courses>
    </app:transcript>

</app:profile>
