<?xml version="1.0" encoding="UTF-8" standalone="yes"?><profile xmlns="http://namespace.profile.com/ns/profile" xmlns:xsi="http://www.w3.org/2001/XMLSchema-instance" xsi:schemaLocation="http://namespace.profile.com/ns/profile profile.xsd"><cv_info><name>Annabelle White</name><address>Kungshamra 5</address><telephone>+34-123321-5312</telephone><email>annaw@kth.se</email><education>Master Software Engineering of Distributed Systems</education><language>English</language><language>Swedish</language><qualifications>Driving license (car)</qualifications><jobType>Permanent</jobType><desiredPosition>Software Developer</desiredPosition><references>Available upon request</references><motivation>I am suitable for the position of a software developer because</motivation></cv_info><empRecord><empName>Annabelle White</empName></empRecord><companyInfo><companies/></companyInfo><transcript><studentName>Annabelle White</studentName><university>KTH</university><program>Masters Software Engineering of Distributed Systems</program><issueDate>2012-12-23</issueDate><courses><course><code>IK2210</code><title>Distributed Systems, Basic Course</title><credits>7.5</credits><grade>A</grade></course><course><code>IB2210</code><title>Modern Methods in Software Engineering</title><credits>7.5</credits><grade>B</grade></course><course><code>IB2250</code><title>Distributed Artificial Intelligence and Intelligent Agents</title><credits>7.5</credits><grade>A</grade></course></courses></transcript></profile>