<?xml version="1.0" encoding="UTF-8"?>
<app:profile xsi:schemaLocation="http://namespace.profile.com/ns/profile profile.xsd" xmlns:apcv="http://namespace.profile.com/ns/cv" xmlns:com="http://namespace.profile.com/ns/com" xmlns:t="http://namespace.profile.com/ns/transcript" xmlns:xsi="http://www.w3.org/2001/XMLSchema-instance" xmlns:e="http://namespace.profile.com/ns/empRecord" xmlns:app="http://namespace.profile.com/ns/profile">
    <app:cv_info>
        <app:name>Annabelle White</app:name>
        <app:address>Kungshamra 5</app:address>
        <app:telephone>+34-123321-5312</app:telephone>
        <app:email>annaw@kth.se</app:email>
        <app:education>Master Software Engineering of Distributed Systems</app:education>
        <app:language>English</app:language>
        <app:language>Swedish</app:language>
        <app:qualifications>Driving license (car)</app:qualifications>
        <app:jobType>Permanent</app:jobType>
        <app:desiredPosition>Software Developer</app:desiredPosition>
        <app:references>Available upon request</app:references>
        <app:motivation>I am suitable for the position of a software developer because</app:motivation>
    </app:cv_info>
    <app:empRecord>
        <app:empName>Annabelle White</app:empName>
        <app:companyWorked>
            <app:workedAtComId>1</app:workedAtComId>
            <app:workedAt>Nokia</app:workedAt>
            <app:duration>18 months</app:duration>
            <app:year>2011</app:year>
            <app:position>Software Developer</app:position>
        </app:companyWorked>
    </app:empRecord>
    <app:companyInfo>
        <app:companies>
            <app:company>
                <app:companyId>1</app:companyId>
                <app:companyName>Nokia</app:companyName>
                <app:category>Telecommunications</app:category>
                <app:founders>Fredrik Idestam, Leo Mechelin</app:founders>
                <app:ceo>Stephen Elop</app:ceo>
                <app:location>Espoo, Finland</app:location>
                <app:contact>56-806-836-1357</app:contact>
            </app:company>
        </app:companies>
    </app:companyInfo>
    <app:transcript>
        <app:studentName>Annabelle White</app:studentName>
        <app:university>KTH</app:university>
        <app:program>Masters Software Engineering of Distributed Systems</app:program>
        <app:issueDate>2012-12-23</app:issueDate>
        <app:gpa>3.526</app:gpa>
        <app:courses>
            <app:course>
                <app:code>IK2210</app:code>
                <app:title>Distributed Systems, Basic Course</app:title>
                <app:credits>7.5</app:credits>
                <app:grade>A</app:grade>
            </app:course>
            <app:course>
                <app:code>IB2210</app:code>
                <app:title>Modern Methods in Software Engineering</app:title>
                <app:credits>7.5</app:credits>
                <app:grade>B</app:grade>
            </app:course>
            <app:course>
                <app:code>IB2210</app:code>
                <app:title>Distributed Artificial Intelligence and Intelligent Agents</app:title>
                <app:credits>7.5</app:credits>
                <app:grade>A</app:grade>
            </app:course>
            <app:course>
                <app:code>ID1234</app:code>
                <app:title>Network Programming in Java</app:title>
                <app:credits>6</app:credits>
                <app:grade>B</app:grade>
            </app:course>
        </app:courses>
    </app:transcript>
</app:profile>